<?xml version="1.0" encoding="utf-8"?>
<!DOCTYPE document PUBLIC "+//IDN docutils.sourceforge.net//DTD Docutils Generic//EN//XML" "http://docutils.sourceforge.net/docs/ref/docutils.dtd">
<document source="input/wrongNesting.odt"><bullet_list bullet="*"><list_item><paragraph>First level</paragraph><bullet_list bullet="*"><list_item><paragraph>Second level</paragraph></list_item></bullet_list></list_item></bullet_list><bullet_list bullet="*"><list_item><bullet_list bullet="*"><list_item><paragraph>Second but restarted</paragraph></list_item></bullet_list></list_item></bullet_list></document>
