<?xml version="1.0" encoding="utf-8"?>
<!DOCTYPE document PUBLIC "+//IDN docutils.sourceforge.net//DTD Docutils Generic//EN//XML" "http://docutils.sourceforge.net/docs/ref/docutils.dtd">
<document source="input/twoBullets.odp"><section><title>Slide title</title><bullet_list bullet="*"><list_item><paragraph>First bullet</paragraph></list_item><list_item><paragraph>Second bullet</paragraph></list_item></bullet_list></section></document>
